{
    "$schema": "https://json-schema.org/draft/2020-12/schema",
    "type": "object",
    "required": ["node_name", "bus_name"],
    "additionalProperties": false,
    "properties": {
        "node_name": { "type": "string" },
        "bus_name": { "type": "string" },
        "tx": {
            "type": "array",
            "items": { "$ref": "file:///message_schema.json#/$defs/tx_message" }
        },
        "rx": {
            "type": "array",
            "items": { "$ref": "file:///message_schema.json#/$defs/rx_message" }
        }
    }
}
