{
    "node_name": "IZZE_IMU",
    "bus_name": "VCAN",
    "tx": [
        {
            "msg_name": "Angular_Rate",
            "msg_desc": "Angular Rate",
            "signals": [
                {
                    "sig_name": "X_axis",
                    "sig_desc": "Angular Rate around X-axis",
                    "type": "int16_t",
                    "unit": "deg/s",
                    "scale": 0.1
                },
                {
                    "sig_name": "Y_axis",
                    "sig_desc": "Angular Rate around Y-axis",
                    "type": "int16_t",
                    "unit": "deg/s",
                    "scale": 0.1
                },
                {
                    "sig_name": "Z_axis",
                    "sig_desc": "Angular Rate around Z-axis",
                    "type": "int16_t",
                    "unit": "deg/s",
                    "scale": 0.1
                },
                {
                    "sig_name": "reserved",
                    "sig_desc": "reserved",
                    "type": "uint16_t"
                }
            ],
            "msg_period": 10,
            "msg_id_override": "0x4EC",
            "msg_priority": 5
        },
        {
            "msg_name": "Acceleration",
            "msg_desc": "Acceleration",
            "signals": [
                {
                    "sig_name": "X_axis",
                    "sig_desc": "Acceleration along X-axis",
                    "type": "int16_t",
                    "unit": "g",
                    "scale": 0.01
                },
                {
                    "sig_name": "Y_axis",
                    "sig_desc": "Acceleration along Y-axis",
                    "type": "int16_t",
                    "unit": "g",
                    "scale": 0.01
                },
                {
                    "sig_name": "Z_axis",
                    "sig_desc": "Acceleration along Z-axis",
                    "type": "int16_t",
                    "unit": "g",
                    "scale": 0.01
                },
                {
                    "sig_name": "temperature",
                    "sig_desc": "IMU Temperature",
                    "type": "int16_t",
                    "unit": "C",
                    "scale": 0.1
                }
            ],
            "msg_period": 10,
            "msg_id_override": "0x4ED",
            "msg_priority": 5
        }
    ],
    "rx": [
        {
            "msg_name": "IZZE_IMU_config"
        }
    ]
}