{
    "node_name": "BOOTLOADER",
    "bus_name": "VCAN",
    "tx": [
        {
            "msg_name": "bl_main_module_cmd",
            "msg_desc": "Bootloader command for main module",
            "signals": [
                {
                    "sig_name": "cmd",
                    "type": "uint8_t"
                },
                {
                    "sig_name": "data",
                    "type": "uint32_t"
                }
            ],
            "msg_id_override": "0x180",
            "msg_priority": 0
        },
        {
            "msg_name": "bl_main_module_data",
            "msg_desc": "Bootloader firmware data for main module",
            "signals": [
                {
                    "sig_name": "index",
                    "type": "uint16_t"
                },
                {
                    "sig_name": "data",
                    "type": "uint32_t"
                }
            ],
            "msg_id_override": "0x181",
            "msg_priority": 0
        },
        {
            "msg_name": "bl_dashboard_cmd",
            "msg_desc": "Bootloader command for dashboard",
            "signals": [
                {
                    "sig_name": "cmd",
                    "type": "uint8_t"
                },
                {
                    "sig_name": "data",
                    "type": "uint32_t"
                }
            ],
            "msg_id_override": "0x183",
            "msg_priority": 0
        },
        {
            "msg_name": "bl_dashboard_data",
            "msg_desc": "Bootloader firmware data for dashboard",
            "signals": [
                {
                    "sig_name": "index",
                    "type": "uint16_t"
                },
                {
                    "sig_name": "data",
                    "type": "uint32_t"
                }
            ],
            "msg_id_override": "0x184",
            "msg_priority": 0
        },
        {
            "msg_name": "bl_torque_vector_cmd",
            "msg_desc": "Bootloader command for torque vector",
            "signals": [
                {
                    "sig_name": "cmd",
                    "type": "uint8_t"
                },
                {
                    "sig_name": "data",
                    "type": "uint32_t"
                }
            ],
            "msg_id_override": "0x186",
            "msg_priority": 0
        },
        {
            "msg_name": "bl_torque_vector_data",
            "msg_desc": "Bootloader firmware data for torque vector",
            "signals": [
                {
                    "sig_name": "index",
                    "type": "uint16_t"
                },
                {
                    "sig_name": "data",
                    "type": "uint32_t"
                }
            ],
            "msg_id_override": "0x187",
            "msg_priority": 0
        },
        {
            "msg_name": "bl_a_box_cmd",
            "msg_desc": "Bootloader command for a box",
            "signals": [
                {
                    "sig_name": "cmd",
                    "type": "uint8_t"
                },
                {
                    "sig_name": "data",
                    "type": "uint32_t"
                }
            ],
            "msg_id_override": "0x189",
            "msg_priority": 0
        },
        {
            "msg_name": "bl_a_box_data",
            "msg_desc": "Bootloader firmware data for a box",
            "signals": [
                {
                    "sig_name": "index",
                    "type": "uint16_t"
                },
                {
                    "sig_name": "data",
                    "type": "uint32_t"
                }
            ],
            "msg_id_override": "0x18A",
            "msg_priority": 0
        },
        {
            "msg_name": "bl_pdu_cmd",
            "msg_desc": "Bootloader command for pdu",
            "signals": [
                {
                    "sig_name": "cmd",
                    "type": "uint8_t"
                },
                {
                    "sig_name": "data",
                    "type": "uint32_t"
                }
            ],
            "msg_id_override": "0x18C",
            "msg_priority": 0
        },
        {
            "msg_name": "bl_pdu_data",
            "msg_desc": "Bootloader firmware data for pdu",
            "signals": [
                {
                    "sig_name": "index",
                    "type": "uint16_t"
                },
                {
                    "sig_name": "data",
                    "type": "uint32_t"
                }
            ],
            "msg_id_override": "0x18D",
            "msg_priority": 0
        },
        {
            "msg_name": "bl_driveline_cmd",
            "msg_desc": "Bootloader command for driveline",
            "signals": [
                {
                    "sig_name": "cmd",
                    "type": "uint8_t"
                },
                {
                    "sig_name": "data",
                    "type": "uint32_t"
                }
            ],
            "msg_id_override": "0x18F",
            "msg_priority": 0
        },
        {
            "msg_name": "bl_driveline_data",
            "msg_desc": "Bootloader firmware data for driveline",
            "signals": [
                {
                    "sig_name": "index",
                    "type": "uint16_t"
                },
                {
                    "sig_name": "data",
                    "type": "uint32_t"
                }
            ],
            "msg_id_override": "0x190",
            "msg_priority": 0
        },
        {
            "msg_name": "bl_g4_testing_cmd",
            "msg_desc": "Bootloader command for g4 testing",
            "signals": [
                {
                    "sig_name": "cmd",
                    "type": "uint8_t"
                },
                {
                    "sig_name": "data",
                    "type": "uint32_t"
                }
            ],
            "msg_id_override": "0x192",
            "msg_priority": 0
        },
        {
            "msg_name": "bl_g4_testing_data",
            "msg_desc": "Bootloader firmware data for g4 testing",
            "signals": [
                {
                    "sig_name": "index",
                    "type": "uint16_t"
                },
                {
                    "sig_name": "data",
                    "type": "uint32_t"
                }
            ],
            "msg_id_override": "0x193",
            "msg_priority": 0
        }
    ],
    "rx": [
        {
            "msg_name": "bl_main_module_resp"
        },
        {
            "msg_name": "bl_dashboard_resp"
        },
        {
            "msg_name": "bl_torque_vector_resp"
        },
        {
            "msg_name": "bl_a_box_resp"
        },
        {
            "msg_name": "bl_pdu_resp"
        },
        {
            "msg_name": "bl_driveline_resp"
        },
        {
            "msg_name": "bl_g4_testing_resp"
        }
    ]
}
