{
    "node_name": "ELCON_CHARGER",
    "bus_name": "CCAN",
    "tx": [
        {
            "msg_name": "elcon_charger_status",
            "msg_desc": "Realtime charger status",
            "signals": [
                {
                    "sig_name": "charge_voltage",
                    "unit": "V",
                    "scale": 0.1,
                    "type": "uint16_t"
                },
                {
                    "sig_name": "charge_current",
                    "unit": "A",
                    "scale": 0.1,
                    "type": "uint16_t"
                },
                {
                    "sig_name": "hw_fail",
                    "sig_desc": "Hardware failure",
                    "type": "bool"
                },
                {
                    "sig_name": "temp_fail",
                    "sig_desc": "Temperature failure",
                    "type": "bool"
                },
                {
                    "sig_name": "input_v_fail",
                    "sig_desc": "Input voltage failure",
                    "type": "bool"
                },
                {
                    "sig_name": "startup_fail",
                    "sig_desc": "Startup voltage detection failure",
                    "type": "bool"
                },
                {
                    "sig_name": "communication_fail",
                    "sig_desc": " 5s timeout from communication failure",
                    "type": "bool"
                }
            ],
            "msg_id_override": "0x18FF50E5",
            "msg_period": 2000,
            "msg_priority": 3
        }
    ],
    "rx": []
}
